{
  "schemaVersion": 1,
  "benchmarkIdentity": {
    "protocolVersion": 1,
    "sampleSchemaVersion": 1,
    "suite": "standard",
    "runId": "standard-1787363625196-1110733",
    "fixtureSha256": {
      "control": "16719d89bc7900f4864117e9d3eacd686d6ba27c29aa9b5a115c4651da527c14",
      "densitate": "c2046b4886c40120f97b8c608866fff6b564222c75d65c7f886f86f15ed811df",
      "mare": "fe0da12b305eff8f9c7b672b0d055c7e252335cae41f7484d93c359e2f7eb7d5",
      "margine-disk": "37e5c25c092acc84cebb76edb7874bea9e314339a247ee9a44b11c8238b1a894",
      "peste-limita": "ebf581dc0890f3c5118bcf1f056bd69750de5fc3cd4f816763a8785807c9f52d"
    },
    "environment": {
      "rustcVersion": "rustc 1.96.1 (31fca3adb 2026-06-26)",
      "cargoVersion": "cargo 1.96.1 (356927216 2026-06-26)",
      "nodeVersion": "v24.18.0",
      "zolaVersion": "zola 0.22.1",
      "kernel": "Linux 7.0.0-29-generic x86_64 GNU/Linux",
      "cpuModel": "Intel(R) Xeon(R) CPU E5-2620 v3 @ 2.40GHz",
      "logicalCpuCount": 12,
      "memoryTotalKib": 16289716,
      "cpuGovernors": [
        "schedutil"
      ]
    }
  },
  "rawSampleCount": 7834,
  "summaries": [
    {
      "layer": "build",
      "scenario": "check",
      "profile": "control",
      "mode": "cold_process",
      "metric": "cpu",
      "distribution": {
        "sampleCount": 1,
        "p50": 4.0,
        "p95": 4.0,
        "p99": null,
        "max": 4.0,
        "mean": 4.0,
        "minimum": 4.0,
        "unit": "ticks"
      },
      "failedSamples": 0
    },
    {
      "layer": "build",
      "scenario": "check",
      "profile": "control",
      "mode": "cold_process",
      "metric": "peak_pss",
      "distribution": {
        "sampleCount": 1,
        "p50": 27957.0,
        "p95": 27957.0,
        "p99": null,
        "max": 27957.0,
        "mean": 27957.0,
        "minimum": 27957.0,
        "unit": "KiB"
      },
      "failedSamples": 0
    },
    {
      "layer": "build",
      "scenario": "check",
      "profile": "control",
      "mode": "cold_process",
      "metric": "peak_rss",
      "distribution": {
        "sampleCount": 1,
        "p50": 29964.0,
        "p95": 29964.0,
        "p99": null,
        "max": 29964.0,
        "mean": 29964.0,
        "minimum": 29964.0,
        "unit": "KiB"
      },
      "failedSamples": 0
    },
    {
      "layer": "build",
      "scenario": "check",
      "profile": "control",
      "mode": "cold_process",
      "metric": "read",
      "distribution": {
        "sampleCount": 1,
        "p50": 0.0,
        "p95": 0.0,
        "p99": null,
        "max": 0.0,
        "mean": 0.0,
        "minimum": 0.0,
        "unit": "bytes"
      },
      "failedSamples": 0
    },
    {
      "layer": "build",
      "scenario": "check",
      "profile": "control",
      "mode": "cold_process",
      "metric": "wall",
      "distribution": {
        "sampleCount": 1,
        "p50": 42.788,
        "p95": 42.788,
        "p99": null,
        "max": 42.788,
        "mean": 42.788,
        "minimum": 42.788,
        "unit": "ms"
      },
      "failedSamples": 0
    },
    {
      "layer": "build",
      "scenario": "check",
      "profile": "control",
      "mode": "cold_process",
      "metric": "write",
      "distribution": {
        "sampleCount": 1,
        "p50": 0.0,
        "p95": 0.0,
        "p99": null,
        "max": 0.0,
        "mean": 0.0,
        "minimum": 0.0,
        "unit": "bytes"
      },
      "failedSamples": 0
    },
    {
      "layer": "build",
      "scenario": "check",
      "profile": "densitate",
      "mode": "cold_process",
      "metric": "cpu",
      "distribution": {
        "sampleCount": 1,
        "p50": 9.0,
        "p95": 9.0,
        "p99": null,
        "max": 9.0,
        "mean": 9.0,
        "minimum": 9.0,
        "unit": "ticks"
      },
      "failedSamples": 0
    },
    {
      "layer": "build",
      "scenario": "check",
      "profile": "densitate",
      "mode": "cold_process",
      "metric": "peak_pss",
      "distribution": {
        "sampleCount": 1,
        "p50": 25944.0,
        "p95": 25944.0,
        "p99": null,
        "max": 25944.0,
        "mean": 25944.0,
        "minimum": 25944.0,
        "unit": "KiB"
      },
      "failedSamples": 0
    },
    {
      "layer": "build",
      "scenario": "check",
      "profile": "densitate",
      "mode": "cold_process",
      "metric": "peak_rss",
      "distribution": {
        "sampleCount": 1,
        "p50": 27796.0,
        "p95": 27796.0,
        "p99": null,
        "max": 27796.0,
        "mean": 27796.0,
        "minimum": 27796.0,
        "unit": "KiB"
      },
      "failedSamples": 0
    },
    {
      "layer": "build",
      "scenario": "check",
      "profile": "densitate",
      "mode": "cold_process",
      "metric": "read",
      "distribution": {
        "sampleCount": 1,
        "p50": 0.0,
        "p95": 0.0,
        "p99": null,
        "max": 0.0,
        "mean": 0.0,
        "minimum": 0.0,
        "unit": "bytes"
      },
      "failedSamples": 0
    },
    {
      "layer": "build",
      "scenario": "check",
      "profile": "densitate",
      "mode": "cold_process",
      "metric": "wall",
      "distribution": {
        "sampleCount": 1,
        "p50": 98.789,
        "p95": 98.789,
        "p99": null,
        "max": 98.789,
        "mean": 98.789,
        "minimum": 98.789,
        "unit": "ms"
      },
      "failedSamples": 0
    },
    {
      "layer": "build",
      "scenario": "check",
      "profile": "densitate",
      "mode": "cold_process",
      "metric": "write",
      "distribution": {
        "sampleCount": 1,
        "p50": 0.0,
        "p95": 0.0,
        "p99": null,
        "max": 0.0,
        "mean": 0.0,
        "minimum": 0.0,
        "unit": "bytes"
      },
      "failedSamples": 0
    },
    {
      "layer": "build",
      "scenario": "check",
      "profile": "mare",
      "mode": "cold_process",
      "metric": "cpu",
      "distribution": {
        "sampleCount": 1,
        "p50": 14.0,
        "p95": 14.0,
        "p99": null,
        "max": 14.0,
        "mean": 14.0,
        "minimum": 14.0,
        "unit": "ticks"
      },
      "failedSamples": 0
    },
    {
      "layer": "build",
      "scenario": "check",
      "profile": "mare",
      "mode": "cold_process",
      "metric": "peak_pss",
      "distribution": {
        "sampleCount": 1,
        "p50": 30125.0,
        "p95": 30125.0,
        "p99": null,
        "max": 30125.0,
        "mean": 30125.0,
        "minimum": 30125.0,
        "unit": "KiB"
      },
      "failedSamples": 0
    },
    {
      "layer": "build",
      "scenario": "check",
      "profile": "mare",
      "mode": "cold_process",
      "metric": "peak_rss",
      "distribution": {
        "sampleCount": 1,
        "p50": 32136.0,
        "p95": 32136.0,
        "p99": null,
        "max": 32136.0,
        "mean": 32136.0,
        "minimum": 32136.0,
        "unit": "KiB"
      },
      "failedSamples": 0
    },
    {
      "layer": "build",
      "scenario": "check",
      "profile": "mare",
      "mode": "cold_process",
      "metric": "read",
      "distribution": {
        "sampleCount": 1,
        "p50": 0.0,
        "p95": 0.0,
        "p99": null,
        "max": 0.0,
        "mean": 0.0,
        "minimum": 0.0,
        "unit": "bytes"
      },
      "failedSamples": 0
    },
    {
      "layer": "build",
      "scenario": "check",
      "profile": "mare",
      "mode": "cold_process",
      "metric": "wall",
      "distribution": {
        "sampleCount": 1,
        "p50": 152.463,
        "p95": 152.463,
        "p99": null,
        "max": 152.463,
        "mean": 152.463,
        "minimum": 152.463,
        "unit": "ms"
      },
      "failedSamples": 0
    },
    {
      "layer": "build",
      "scenario": "check",
      "profile": "mare",
      "mode": "cold_process",
      "metric": "write",
      "distribution": {
        "sampleCount": 1,
        "p50": 0.0,
        "p95": 0.0,
        "p99": null,
        "max": 0.0,
        "mean": 0.0,
        "minimum": 0.0,
        "unit": "bytes"
      },
      "failedSamples": 0
    },
    {
      "layer": "build",
      "scenario": "check",
      "profile": "margine-disk",
      "mode": "cold_process",
      "metric": "cpu",
      "distribution": {
        "sampleCount": 1,
        "p50": 5.0,
        "p95": 5.0,
        "p99": null,
        "max": 5.0,
        "mean": 5.0,
        "minimum": 5.0,
        "unit": "ticks"
      },
      "failedSamples": 0
    },
    {
      "layer": "build",
      "scenario": "check",
      "profile": "margine-disk",
      "mode": "cold_process",
      "metric": "peak_pss",
      "distribution": {
        "sampleCount": 1,
        "p50": 24189.0,
        "p95": 24189.0,
        "p99": null,
        "max": 24189.0,
        "mean": 24189.0,
        "minimum": 24189.0,
        "unit": "KiB"
      },
      "failedSamples": 0
    },
    {
      "layer": "build",
      "scenario": "check",
      "profile": "margine-disk",
      "mode": "cold_process",
      "metric": "peak_rss",
      "distribution": {
        "sampleCount": 1,
        "p50": 26212.0,
        "p95": 26212.0,
        "p99": null,
        "max": 26212.0,
        "mean": 26212.0,
        "minimum": 26212.0,
        "unit": "KiB"
      },
      "failedSamples": 0
    },
    {
      "layer": "build",
      "scenario": "check",
      "profile": "margine-disk",
      "mode": "cold_process",
      "metric": "read",
      "distribution": {
        "sampleCount": 1,
        "p50": 0.0,
        "p95": 0.0,
        "p99": null,
        "max": 0.0,
        "mean": 0.0,
        "minimum": 0.0,
        "unit": "bytes"
      },
      "failedSamples": 0
    },
    {
      "layer": "build",
      "scenario": "check",
      "profile": "margine-disk",
      "mode": "cold_process",
      "metric": "wall",
      "distribution": {
        "sampleCount": 1,
        "p50": 54.798,
        "p95": 54.798,
        "p99": null,